#STARTDIALOGUE				
Can you tell me more about your frequent urination?	tell me more about your back pain	My buddy lives on the second floor in an apartment building.  We needed to bring everything down and there were only 3 of us.  I bent down to help lift the couch and my back has been hurting ever since.	tell me more about your back pain	True
How about your frequent urination?	describe the frequent urination	Not very frequent, every now and then.	how frequent is the frequent urination	False
Is there anything else you wanted to talk about during this visit?	any other problems	The occasional need to urinate more frequently.	any other problems	True
Have you noticed any color change with your urination?	negative symptoms	No.	negative symptoms	True
Are you experiencing any burning or stinging when  you urinate?	have you noticed pain while urinating	I haven't had any pain like that.	have you noticed pain while urinating	True
How often are you urinating?	how often do you urinate	I don't know exactly, several times a day.	how often do you urinate	True
Can you tell me more about your urination?	tell me more about your back pain	My buddy lives on the second floor in an apartment building.  We needed to bring everything down and there were only 3 of us.  I bent down to help lift the couch and my back has been hurting ever since.	tell me more about your back pain	True
Are you drinking more water?	do you drink enough fluid	Yes, I drink 4-5 glasses of water per day.	do you drink enough fluid	True
You said you're an automechanic. Has your pain or urination been affecting your work?	none	I haven't had any pain like that.	have you noticed pain while urinating	False
Do you have any hobbies?	do you have any hobbies	I like to restore old cars.	do you have any hobbies	True
Alright, well I'll take my notes back to the physician and we'll see what we can do to get you  back to work healthy.	none	I am an auto mechanic.  I have my own garage where  I do repairs and custom restorations.	what do you do for a living	False
#STARTDIALOGUE				
Hello Mr. Wilkins. What brings you in today?	what brings you in today	I was hoping you could help me with my back pain, it really hurts! It has been awful.   I can barely even tie my shoes.	what brings you in today	True
I am sorry, this back pain sounds like it is making your life very difficult. Before, we talk about your back pain is there anything else you would like to talk about?	tell me about yourself	[ Fear2 ]Well, I am an auto mechanic and I own my own shop. I love my work. I have a good group of friends that I enjoy hanging out with and that's about it.	tell me about yourself	True
Ok, thank you for sharing this with me. Before we begin, Iwould like to set up an agenda with you. We will review youtr back pain and then do a complete history. Does that sound ok?	ok then	Alrighty.	ok then	True
Great! So tell me about your back pain	describe the pain	It is.	good	False
Tell me about your back pain	describe the pain	It's a dull ache right in the middle of my lower back.	describe the pain	True
Can you describe what you mean by dull?	is the pain dull	I'm sorry, I don't understand that question. Would you restate it?	none	False
What do you mean by dull?	what do you do for fun	I'm afraid I don't understand that question.	none	False
Can you describe where the pain is?	where is the pain	It is mostly in my lower back.	where is the pain	True
Is it in one spot or has it spread?	does the pain radiate	Not that I have noticed.  It pretty much just stays in my back.	does the pain radiate	True
Ok. Can you describe the pain?	describe the pain	It's a dull ache right in the middle of my lower back.	describe the pain	True
Can you rate the pain on a scale of 1-10?	can you rate the pain	[ Pain2 ]Right now, I would call my pain a 7. When I take the ibuprofen, it goes down to about a 5 or 6.	can you rate the pain	True
Can you tell me how the pain started?	how did the pain start	[ Pain2 ]It started hurting after I was lifting some furniture with a friend. Ever since then I can barely move.	how did the pain start	True
Wow, that sounds like it is making your life very difficult. When did the pain begin?	when did the pain start	The pain started about four or five days ago.	when did the pain start	True
Has the pain gotten worse?	is the pain improving	[ Fear2 ]I don't know if it is getting worse or not. It pretty much just hurts all the time.	is the pain improving	True
Are there certain times of the day when it hurts more?	is the pain worse in the morning or at night	[ Sadness2 ] It hurts all the time.  I haven't really noticed if morning or night is better.  In the morning it feels really stiff so it is pretty bad.  In the night though it is really achy.	is the pain worse in the morning or at night	True
Wow, thank you for sharing with me. Are you having any other symptoms besides pain?	are you having any other pain	What? Only the pain in my lower back.	are you having any other pain	True
Ok, just clarifying. Thank you	thanks	[ Happiness2 ]Thank you	thanks	True
Have you taken any medications?	are you taking any medication	I have been taking ibuprofen for a few days.	are you taking any medication	True
Tell me how that has helped	did the ibuprofen help	It helped some, but it doesn't make the pain go away.	did the ibuprofen help	True
How does it help	did the ibuprofen help	It helped some, but it doesn't make the pain go away.	did the ibuprofen help	True
Ok. So I think I have a good understanding of the present illness. Now I am going to ask about the past medical history	what is your past medical history	This back pain is really my first issue.	what is your past medical history	True
Have you had any other medical issues in the past?	what is your past medical history	This back pain is really my first issue.	what is your past medical history	True
OK. Have you ever been in the hospital?	have you ever been in the hospital	I avoid those places. I hope to avoid them all of my life.	have you ever been in the hospital	True
OK, well I'm happy to hear you have not been in the hospital before	none	I avoid those places. I hope to avoid them all of my life.	have you ever been in the hospital	False
Besides the ibuprofen, what other medications have you taken?	are you taking any other medication	I took some ibuprofen for a few days.	what pills did you take	False
#STARTDIALOGUE				
Hi Mr. Wilkins. My name is Olivia Crowe and I am a medical student. 	i am medical student	Nice to meet you.	i am medical student	True
Can you tell me about what brings you in today?	what brings you in today	I was hoping you could help me with my back pain, it really hurts! It has been awful.   I can barely even tie my shoes.	what brings you in today	True
That sounds very painful. Before we address this, is there anything else?	any other problems	The occasional need to urinate more frequently.	any other problems	True
Okay. Anything else?	any other problems	I don't think so.	any other problems	True
We have 20 minutes today and I definitely want to address your back pain	i will do my best	I appreciate that.	i will do my best	True
If we have time I would also like to talk about your increased urination.	none	[ Fear2 ]Well, I am an auto mechanic and I own my own shop. I love my work. I have a good group of friends that I enjoy hanging out with and that's about it.	tell me about yourself	False
When did your back pain start?	when did the pain start	The pain started about four or five days ago.	when did the pain start	True
Where on your back is the pain located? Does it spread anywhere else?	do you have pain anywhere else	Just my back.	do you have pain anywhere else	True
Is it constant or does it come and go?	is the pain constant	[ Fear2 ]It is pretty constant although sometimes it is a little better or worse.	is the pain constant	True
Does anything seem to make it worse?	what makes the pain worse	[ Pain3 ]Bending down and moving makes it feel a lot worse.	what makes the pain worse	True
Does anything make it better?	what makes the pain better	[ Sadness2 ]The only thing that seems to help some is ibuprofen, and that doesn't help all that much.	what makes the pain better	True
How often are you taking ibuprofen and how much?	how often do you take the ibuprofen	I just did what it said on the bottle, two every 8 hours or so.	how often do you take the ibuprofen	True
On a scale of 1-10, 10 being the worst pain imaginable, how bad is it?	can you rate the pain	[ Pain2 ]Right now, I would call my pain a 7. When I take the ibuprofen, it goes down to about a 5 or 6.	can you rate the pain	True
Is it worse in the morning or evening?	is the pain worse in the morning or at night	[ Sadness2 ] It hurts all the time.  I haven't really noticed if morning or night is better.  In the morning it feels really stiff so it is pretty bad.  In the night though it is really achy.	is the pain worse in the morning or at night	True
What I hear is that your back pain gets worse with bending and moving	to summarize	[ Fear2 ]It seems like every time I move it hurts.	does moving increase the pain	False
It doesn't get better with ibuprofen and is normally at a 7.	to summarize	I'm afraid I don't understand that question.	none	False
How has this impacted you at work?	how has this affected you	[ Fear1 ]I haven't been able to work.	how has this affected you	True
What about your home life? 	how is home	I'm afraid I don't understand that question.	none	False
Can you drive with the pain?	unknown	I can drive, but getting in and out of the car is pretty painful right now.	unknown	True
I am now going to ask you about your past medical history	what is your past medical history	This back pain is really my first issue.	what is your past medical history	True
Do you have any other illnesses?	have you ever had any serious illnesses	I'm sorry, I don't understand that question. Would you restate it?	none	False
Have you had any illlnesses in the past?	have you ever had any chronic illnesses	I'm afraid I don't understand that question.	none	False
Have you ever had any accidents?	have you ever been in an accident	I have been in a couple of fender benders in my lifetime, but those were years ago and I sustained no injuries from them.	have you ever been in an accident	True
Have you ever been hospitalized?	have you ever been in the hospital	I avoid those places. I hope to avoid them all of my life.	have you ever been in the hospital	True
Did you have a bad experience at a hospital?	none	I'm afraid I don't understand that question.	none	True
Are all of your immunizations up to date?	are you current on vaccinations	I am up to date.	are you current on vaccinations	True
Are you currently taking any medications besides ibuprofen?	are you taking any other medication	I don't take any OTC medications.	any otc medication	False
Any prescriptions?	any prescription medication	I don't take any prescription medications.	any prescription medication	True
Do you have any allergies?	do you have any allergies	I am not allergic to anything that I know of	do you have any allergies	True
Do you wear your seatbelt when in the car?	none	I'm sorry, I don't understand that question. Would you restate it?	none	True
Have you ever had a colonoscopy?	unknown	Oh, I think I had that a couple years ago. Everything came back fine and I don't have to go back for a few more years.	unknown	True
Have you ever had your prostate checked?	have you had a prostate exam	I remember that from last year.  The doc said it was normal.	have you had a prostate exam	True
How is your blood glucose? 	how is your hip	My blood glucose is fine	how is your hip	True
Is your blood pressure normal?	how is your blood pressure	My blood pressure has been normal I think.  I know the doctor last year told me it was ok.  Hopefully it is ok now too.	how is your blood pressure	True
Are your parents alive?	are your parents living	Both of my parents are alive and well.	are your parents living	True
Good I am glad to hear that. Do you have any children?	do you have any children	I have no children.	do you have any children	True
Is there a family history of any illness?	any family history of illness	Nothing that I can think of. My parents are healthy and they donn't have any unusual illnesses. I don't really know much about my grandparents.	any family history of illness	True
Are you married?	are you married	I'm single.	are you married	True
Do you live by yourself?	do you live alone	I live by myself.	do you live alone	True
You mentioned you work at a tire company. How long have you worked there>	how long have you been a worker	About 17 years. I own my own garage.	how long have you been a worker	True
Do you enjoy your job?	is your job pleasurable	It is.	is your job pleasurable	True
Is it stressful at times owning your own garage?	is your job stressful	I'm sorry, I don't understand that question. Would you restate it?	none	False
What do you like to do in your free time?	what do you do for fun	I like to watch football and sometimes get together with friends.	what do you do for fun	True
Do you like to exercise?	do you exercise	Don't exercise that much. Occasionally I go jogging or for a long walk.  I am always on my feet for work though.	do you exercise	True
I am now going to ask you a few personal questions if that is alright?	i have more questions	Ok, sure.	i have more questions	True
Do you use any illicit drugs?	do you use illegal drugs	[ Contempt4 ]No, never.  I have seen too many people go down that path.  I never touch the stuff.	do you use illegal drugs	True
Okay, good I am glad to hear that. Do you drink?	do you drink	A beer or 2 at football games, or a glass of wine now and then. Nothing much more than that.	do you drink	True
How often do you have sex?	none	I really don't drink that much. Maybe one or two beers at football games. A glass of wine now and then.	how much do you drink	False
Do you like women or men or both?	do you prefer men or women	I'm afraid I don't understand that question.	none	False
Do you date women or men?	do you prefer men or women	I'm afraid I don't understand that question.	none	False
Are you sexually active?	are you sexually active	I am not currently  sexually active.	are you sexually active	True
Do you have a good support network?	do you have support	[ Sadness3 ]Well, I live alone but I am OK.  I am pretty close with my parents and I have a bunch of good friends.	do you have support	True
Good. Are you normally happy or do you feel sad at times?	are you depressed	I am fine.	are you depressed	True
Do you ever feel depressed or think about hurting yourself?	do you have a history of depression	I have never been depressed	do you have a history of depression	True
Finally, do you feel safe in your life?	do you feel safe at home	I feel safe.  My place is in an ok area, nothing that makes me worried.	do you feel safe at home	True
Okay. Do you have any firearms at home?	do you have a weapon	I'm afraid I don't understand that question.	none	False
Do you own a gun?	do you have a weapon	What? Why would you ask that?.	do you have a weapon	True
I am only asking to know more about you!	none	I'm afraid I don't understand that question.	none	True
Do you have any more questions for me?	do you have any questions	Print(  [No] [No, I think that's all. Thank you for your time])	do you have any questions	True
Thank you Mr. Wilkins. 	thanks	[ Happiness2 ]Thank you	thanks	True
#STARTDIALOGUE				
Hi Mr. Wilkins. My name is Olivia Crowe and I will be taking care of you today	i will do my best	I appreciate that.	i will do my best	True
Could you tell me your date of birth?	when were you born	10-Aug-62	when were you born	True
#STARTDIALOGUE				
Hi Mr. Wilkins, How are you today?	how are you	[ Pain2 ]Well I would be doing pretty well if my back weren't hurting so badly.	how are you	True
Tell me more about this back pain 	tell me more about your back pain	My buddy lives on the second floor in an apartment building.  We needed to bring everything down and there were only 3 of us.  I bent down to help lift the couch and my back has been hurting ever since.	tell me more about your back pain	True
When did this happen?	when did the pain start	The pain started about four or five days ago.	when did the pain start	True
Is the pain constant?	is the pain constant	[ Fear2 ]It is pretty constant although sometimes it is a little better or worse.	is the pain constant	True
Can you try to show or describe where on your back that hurts?	can you point to the pain	I tried some ibuprofen, but I don't think that is helping very much.	what makes the pain better	False
Where on your back hurts?	where is the pain	It is mostly in my lower back.	where is the pain	True
What is the severity of the pain on a scale of 1-10?	can you rate the pain	[ Pain2 ]Right now, I would call my pain a 7. When I take the ibuprofen, it goes down to about a 5 or 6.	can you rate the pain	True
Is the pain dull, sharp, or burning?	is the pain sharp	It seems more dull and achy, not like a knife or something.  It feels more like someone is stepping on me or squeezing really hard.	is the pain sharp	True
Does the pain radiate or does it stay in the same place?	does the pain radiate	Not that I have noticed.  It pretty much just stays in my back.	does the pain radiate	True
Is there anything that makes it worse?	what makes the pain worse	Thank you for your concern.	that must be awful	False
#STARTDIALOGUE				
What brings you in today?	what brings you in today	I was hoping you could help me with my back pain, it really hurts! It has been awful.   I can barely even tie my shoes.	what brings you in today	True
Tell me more about this pain	tell me more about your back pain	My buddy lives on the second floor in an apartment building.  We needed to bring everything down and there were only 3 of us.  I bent down to help lift the couch and my back has been hurting ever since.	tell me more about your back pain	True
Can you rate the pain on a scale of 1 to 10?	can you rate the pain	[ Pain2 ]Right now, I would call my pain a 7. When I take the ibuprofen, it goes down to about a 5 or 6.	can you rate the pain	True
How else are you managing the pain?	have you tried any treatment	I have not tried anything yet except for the ibuprofen.	have you tried any treatment	True
Where on your back does it hurt?	where is the pain	It is mostly in my lower back.	where is the pain	True
Is there any other pain elsewhere?	are you having any other pain	What? Only the pain in my lower back.	are you having any other pain	True
How is this pain affecting you day to day?	how has this affected you	[ Fear1 ]I haven't been able to work.	how has this affected you	True
#STARTDIALOGUE				
Hello, Mr. Wilkins	hello	Hello Doctor.  I am so glad to see you.	hello	True
How are you doing today?	how are you	[ Pain2 ]Well I would be doing pretty well if my back weren't hurting so badly.	how are you	True
Tell me about your back pain.	describe the pain	It's a dull ache right in the middle of my lower back.	describe the pain	True
When did this start	when did the pain start	The pain started about four or five days ago.	when did the pain start	True
How would you rate the pain?	can you rate the pain	[ Pain2 ]Right now, I would call my pain a 7. When I take the ibuprofen, it goes down to about a 5 or 6.	can you rate the pain	True
Have you taken anything else?	any other problems	I'm sorry, I don't understand that question. Would you restate it?	none	False
DId anything occur that mighr have initially caused the pain	did anything happen to cause the pain	A few days ago I was helping one of my friends lift a big heavy couch. When I bent down, I felt a sharp pain in my back.	did anything happen to cause the pain	True
Does anything make it worse	what makes the pain worse	[ Pain3 ]Bending down and moving makes it feel a lot worse.	what makes the pain worse	True
Have you ever had similiar pain?	have you had back pain before	I had some back pain about 4 or 5 years ago, but that was fine after one day and one tylenol.	have you had back pain before	True
Are you taking any medications?	are you taking any medication	I have been taking ibuprofen for a few days.	are you taking any medication	True
Medical history	what is your past medical history	I'm afraid I don't understand that question.	none	False
Any other medical history	what is your past medical history	I'm afraid I don't understand that question.	none	False
any surgeries	any prior surgeries	I have never had any surgeries.  I have gotten stitches a few times when I have done stupid things like slice my finger, but I haven't had any in years.	any prior surgeries	True
Social history	social history	OK	social history	True
Tell me more about urinary frequency	tell me more about your back pain	My buddy lives on the second floor in an apartment building.  We needed to bring everything down and there were only 3 of us.  I bent down to help lift the couch and my back has been hurting ever since.	tell me more about your back pain	True
any other symptoms	any other problems	I don't think so.	any other problems	True
#STARTDIALOGUE				
how are you	how are you	[ Pain2 ]Well I would be doing pretty well if my back weren't hurting so badly.	how are you	True
When did it begin?	when did the pain start	The pain started about four or five days ago.	when did the pain start	True
How did it begin>	how did the pain start	[ Pain2 ]It started hurting after I was lifting some furniture with a friend. Ever since then I can barely move.	how did the pain start	True
How would you rate the pain 1-10	can you rate the pain	[ Pain2 ]Right now, I would call my pain a 7. When I take the ibuprofen, it goes down to about a 5 or 6.	can you rate the pain	True
where is the pain located	where is the pain	It is mostly in my lower back.	where is the pain	True
how would you describe the pain	how is your pain now	[ Pain1 ]It hurts quite a bit now, although not as bad as when I twist or something.  Right now it is mostly stiff.	how is your pain now	True
how has this affected you	how has this affected you	[ Fear1 ]I haven't been able to work.	how has this affected you	True
what work do you do	what do you do for a living	I am an auto mechanic.  I have my own garage where  I do repairs and custom restorations.	what do you do for a living	True
any allergies	do you have any allergies	I am not allergic to anything that I know of	do you have any allergies	True
any medical history	what is your past medical history	I'm afraid I don't understand that question.	none	False
any surgical history	any prior surgeries	I have never had any surgeries.  I have gotten stitches a few times when I have done stupid things like slice my finger, but I haven't had any in years.	any prior surgeries	True
any chronic diseases	do you have any chronic illnesses	I have been very healthy all of my life.  I think I had my cholesterol and sugar checked here last year and everything looked good.	do you have any chronic illnesses	True
any siblings	do you have siblings	I have no brothers or sisters.	do you have siblings	True
any family history of diseases	any family history of illness	Nothing that I can think of. My parents are healthy and they donn't have any unusual illnesses. I don't really know much about my grandparents.	any family history of illness	True
any hospitalizations	have you ever been in the hospital	I avoid those places. I hope to avoid them all of my life.	have you ever been in the hospital	True
any drugs or alcohol	do you drink	A beer or 2 at football games, or a glass of wine now and then. Nothing much more than that.	do you drink	True
sexual history	are you sexually active	I'm afraid I don't understand that question.	none	False
any other symptoms	any other problems	The occasional need to urinate more frequently.	any other problems	True
anything similiar to this happen in the past?	have you had back pain before	I have had some back pain previously. Maybe four or five years ago. It was similar to my pain now but back then just a couple of regular strength Tylenol took care of it and it was gone in one day.	have you had back pain before	True
#STARTDIALOGUE				
Hello, Mr. Wilkins. My name is Juliana and I'm an M1 on your care team today. How are you doing?	how are you	[ Pain2 ]Well I would be doing pretty well if my back weren't hurting so badly.	how are you	True
Yes, that sounds like it must be very bothersome. hy don't you tell me more about our back pain?	tell me more about your back pain	My buddy lives on the second floor in an apartment building.  We needed to bring everything down and there were only 3 of us.  I bent down to help lift the couch and my back has been hurting ever since.	tell me more about your back pain	True
can you tell me more about how that's been affecting you?	tell me more about your back pain	My buddy lives on the second floor in an apartment building.  We needed to bring everything down and there were only 3 of us.  I bent down to help lift the couch and my back has been hurting ever since.	tell me more about your back pain	True
Can you tell me anything else about how you've been feeling since?	none	[ Pain2 ]Well I would be doing pretty well if my back weren't hurting so badly.	how are you	False
Sure, pain can really disrupt our normal schedules. Can you tell me if anything makes the pain better or worse?	what makes the pain worse	[ Pain3 ]Bending down and moving makes it feel a lot worse.	what makes the pain worse	True
Okay, does the pain normally stay in one area of your back or do you feel pain spread all over?	does the pain radiate	Not that I have noticed.  It pretty much just stays in my back.	does the pain radiate	True
Okay, on a scale of 1-10, 10 being the worse pain you've ever felt, what would you rate your pain when you bend down?	unknown	I don't remember much about it.	unknown	True
could you rate your pain on a scale from 1-10?	can you rate the pain	[ Pain2 ]Right now, I would call my pain a 7. When I take the ibuprofen, it goes down to about a 5 or 6.	can you rate the pain	True
